[
  {"id": "bag_end_sold", "at": "3018-09-21T10:00", "type": "world_event", "location": "bag_end", "actors": ["frodo", "lobelia_sackville_baggins"], "effects": [{"set_flag": "bag_end_sold"}], "rumour": {"id": "frodo_sold_bag_end", "origin_poi": "green_dragon", "strength": 4}, "waits_for_player": false, "window_end": null, "depends_on": [], "verify": true},
  {"id": "frodo_birthday", "at": "3018-09-22T18:00", "type": "world_event", "location": "bag_end", "actors": ["frodo", "sam", "pippin"], "effects": [{"set_flag": "frodo_33rd_birthday"}], "waits_for_player": false, "window_end": null, "depends_on": [], "verify": true},
  {"id": "nazgul_cross_sarn_ford", "at": "3018-09-22T21:00", "type": "world_event", "actors": ["black_rider_khamul", "black_riders_group"], "effects": [{"set_flag": "nazgul_crossed_sarn_ford"}], "waits_for_player": false, "window_end": null, "depends_on": [], "verify": false},
  {"id": "nazgul_enter_shire", "at": "3018-09-23T04:00", "type": "world_event", "location": "three_farthing_stone", "actors": ["black_rider_khamul", "black_riders_group"], "effects": [{"set_flag": "nazgul_in_shire"}], "waits_for_player": false, "window_end": null, "depends_on": [], "verify": true},
  {"id": "rider_questions_gaffer", "at": "3018-09-23T19:00", "type": "world_event", "location": "bagshot_row", "actors": ["black_rider_khamul", "gaffer_gamgee"], "effects": [{"set_flag": "gaffer_met_rider"}], "rumour": {"id": "black_rider_in_hobbiton", "origin_poi": "bagshot_row", "strength": 3}, "waits_for_player": false, "window_end": null, "depends_on": [], "verify": true},
  {"id": "rider_searches_bag_end", "at": "3018-09-23T23:00", "type": "world_event", "location": "bag_end", "actors": ["black_rider_khamul"], "effects": [{"set_flag": "bag_end_searched"}], "waits_for_player": false, "window_end": null, "depends_on": [], "verify": true},
  {"id": "frodo_departure_noticed", "at": "3018-09-24T08:00", "type": "world_event", "location": "bag_end", "actors": ["gaffer_gamgee"], "effects": [{"set_flag": "frodo_gone_from_bag_end"}], "rumour": {"id": "frodo_left_bag_end", "origin_poi": "bywater", "strength": 3}, "waits_for_player": false, "window_end": null, "depends_on": [], "verify": true},
  {"id": "hobbits_hide_from_rider", "at": "3018-09-24T18:00", "type": "world_event", "location": "woody_end_camp", "actors": ["black_rider_khamul", "frodo", "sam", "pippin"], "effects": [{"set_flag": "hobbits_hid_from_rider"}], "waits_for_player": false, "window_end": null, "depends_on": [], "verify": true},
  {"id": "gildor_meeting", "at": "3018-09-24T21:30", "type": "world_event", "location": "gildor_camp", "actors": ["gildor_inglorion", "frodo", "sam", "pippin"], "effects": [{"set_flag": "met_gildor"}], "rumour": {"id": "elves_in_woody_end", "origin_poi": "gildor_camp", "strength": 3}, "waits_for_player": false, "window_end": null, "depends_on": ["frodo_meets_gildor"], "verify": false},
  {"id": "rider_questions_maggot", "at": "3018-09-25T10:00", "type": "world_event", "location": "maggots_farm", "actors": ["black_rider_khamul", "farmer_maggot", "mrs_maggot"], "effects": [{"set_flag": "maggot_met_rider"}], "rumour": {"id": "maggot_dogs_and_rider", "origin_poi": "maggots_farm", "strength": 3}, "waits_for_player": false, "window_end": null, "depends_on": [], "verify": true},
  {"id": "maggot_hosts_hobbits", "at": "3018-09-25T12:30", "type": "world_event", "location": "maggots_farm", "actors": ["farmer_maggot", "mrs_maggot", "frodo", "sam", "pippin"], "effects": [{"set_flag": "maggot_befriended"}], "waits_for_player": false, "window_end": null, "depends_on": ["frodo_at_maggots"], "verify": true},
  {"id": "rider_turned_back_at_ferry", "at": "3018-09-25T22:00", "type": "world_event", "location": "bucklebury_ferry", "actors": ["black_rider_khamul"], "effects": [{"set_flag": "rider_turned_back_at_ferry"}], "waits_for_player": false, "window_end": null, "depends_on": [], "verify": true},
  {"id": "party_enters_old_forest", "at": "3018-09-26T09:00", "type": "world_event", "location": "old_forest_edge", "actors": ["frodo", "sam", "pippin", "merry"], "effects": [{"set_flag": "party_in_old_forest"}], "waits_for_player": false, "window_end": null, "depends_on": ["frodo_in_old_forest"], "verify": true},
  {"id": "bombadil_rescue", "at": "3018-09-27T17:00", "type": "world_event", "location": "bombadil_house", "actors": ["frodo", "sam", "pippin", "merry"], "effects": [{"set_flag": "met_bombadil"}], "waits_for_player": false, "window_end": null, "depends_on": ["frodo_at_bombadil"], "verify": true},
  {"id": "barrow_wight", "at": "3018-09-28T13:00", "type": "world_event", "actors": ["frodo", "sam", "pippin", "merry"], "effects": [{"set_flag": "barrow_wight_met"}, {"set_flag": "has_barrow_blade"}], "waits_for_player": false, "window_end": null, "depends_on": [], "verify": true},
  {"id": "gandalf_visits_gaffer", "at": "3018-09-29T09:00", "type": "world_event", "location": "bagshot_row", "actors": ["gandalf", "gaffer_gamgee"], "effects": [{"set_flag": "gandalf_visited_gaffer"}], "rumour": {"id": "gandalf_seen_in_hobbiton", "origin_poi": "bagshot_row", "strength": 3}, "waits_for_player": false, "window_end": null, "depends_on": ["gandalf_arrives_hobbiton"], "verify": true},
  {"id": "riders_at_west_gate", "at": "3018-09-29T17:30", "type": "world_event", "location": "bree_west_gate", "actors": ["black_rider_khamul"], "effects": [{"set_flag": "riders_at_bree_gate"}], "rumour": {"id": "black_riders_asking_for_baggins", "origin_poi": "bree_west_gate", "strength": 4}, "waits_for_player": false, "window_end": null, "depends_on": [], "verify": true},
  {"id": "party_arrives_pony", "at": "3018-09-29T20:30", "type": "itinerary_step", "location": "prancing_pony", "actors": ["frodo", "sam", "pippin", "merry", "barliman_butterbur", "nob"], "effects": [{"move_entity": {"id": "frodo", "poi": "prancing_pony"}}, {"move_entity": {"id": "sam", "poi": "prancing_pony"}}, {"move_entity": {"id": "pippin", "poi": "prancing_pony"}}, {"move_entity": {"id": "merry", "poi": "prancing_pony"}}, {"set_flag": "party_in_bree"}], "waits_for_player": true, "window_end": "3018-10-08", "depends_on": [], "verify": false, "trigger_area": {"settlement": "bree"}},
  {"id": "frodo_slips_ring_on", "at": "3018-09-29T22:30", "type": "world_event", "location": "prancing_pony", "actors": ["frodo", "barliman_butterbur"], "effects": [{"set_flag": "frodo_vanished_in_common_room"}], "rumour": {"id": "hobbit_vanished_at_pony", "origin_poi": "prancing_pony", "strength": 5}, "waits_for_player": false, "window_end": null, "depends_on": ["party_arrives_pony"], "verify": true},
  {"id": "strider_speaks_to_hobbits", "at": "3018-09-29T23:30", "type": "world_event", "location": "prancing_pony", "actors": ["strider", "frodo", "sam", "pippin", "merry"], "effects": [{"set_flag": "strider_met_hobbits"}], "waits_for_player": false, "window_end": null, "depends_on": ["party_arrives_pony", "frodo_slips_ring_on"], "verify": false},
  {"id": "pony_raided", "at": "3018-09-30T01:30", "type": "world_event", "location": "prancing_pony", "actors": ["black_rider_khamul", "barliman_butterbur", "nob"], "effects": [{"set_flag": "pony_beds_slashed"}], "rumour": {"id": "black_riders_raid_pony", "origin_poi": "prancing_pony", "strength": 5}, "waits_for_player": false, "window_end": null, "depends_on": ["party_arrives_pony"], "verify": true},
  {"id": "crickhollow_raid", "at": "3018-09-30T02:00", "type": "world_event", "location": "crickhollow", "actors": ["black_riders_group", "fatty_bolger"], "effects": [{"set_flag": "crickhollow_raided"}], "rumour": {"id": "horn_of_buckland", "origin_poi": "crickhollow", "strength": 5}, "waits_for_player": false, "window_end": null, "depends_on": [], "verify": true},
  {"id": "bill_the_pony_bought", "at": "3018-09-30T08:30", "type": "world_event", "location": "prancing_pony", "actors": ["barliman_butterbur", "strider", "frodo"], "effects": [{"give_item": {"item": "bill_the_pony", "from": "", "to": "frodo"}}, {"set_flag": "bought_bill_the_pony"}], "waits_for_player": false, "window_end": null, "depends_on": ["party_arrives_pony"], "verify": true},
  {"id": "party_departs_bree_noticed", "at": "3018-09-30T09:30", "type": "world_event", "location": "prancing_pony", "actors": ["barliman_butterbur", "bill_ferny"], "effects": [{"set_flag": "party_left_bree"}], "rumour": {"id": "hobbits_left_with_strider", "origin_poi": "prancing_pony", "strength": 3}, "waits_for_player": false, "window_end": null, "depends_on": ["frodo_leaves_bree"], "verify": true},
  {"id": "lobelia_takes_bag_end", "at": "3018-10-02T11:00", "type": "world_event", "location": "bag_end", "actors": ["lobelia_sackville_baggins"], "effects": [{"set_flag": "lobelia_in_bag_end"}], "rumour": {"id": "lobelia_moved_into_bag_end", "origin_poi": "bag_end", "strength": 4}, "waits_for_player": false, "window_end": null, "depends_on": [], "verify": true},
  {"id": "weathertop_attack", "at": "3018-10-06T23:00", "type": "world_event", "location": "east_map_edge", "actors": ["frodo", "sam", "pippin", "merry", "strider", "black_rider_khamul", "black_riders_group"], "effects": [{"set_flag": "weathertop_attack"}], "rumour": {"id": "weathertop_attack", "origin_poi": "east_map_edge", "strength": 1}, "waits_for_player": false, "window_end": null, "depends_on": ["frodo_off_map"], "verify": true}
]
